{
  "lifecycle": {"revision":"1","applicability":"Offline laser/cut-bracket synthetic material fixture only; no physical manufacturing applicability established.","units":{},"verification":{"status":"unverified","reviewed_revision":null,"reviewer":null,"reviewed_at":null,"evidence":[],"notes":"Synthetic fixture declaration; no practitioner review has been performed."}},
  "material_id": "fixture-plywood",
  "process_family": "laser_cutting",
  "grade_or_profile": "synthetic plywood profile",
  "properties": {},
  "compatibility": {"machines": ["fixture-laser-40w"], "process_profiles": ["fixture-plywood-profile"]},
  "environmental_requirements": {"ventilation_status": "known", "unsafe_material_status": "not_indicated"},
  "source": {"title": "Synthetic laser material profile", "publisher": "CAD/CAM Skills", "locator": "fixtures/laser/cut-bracket/contexts/material.json", "published_at": null, "accessed_at": "2026-09-13", "scope": "Offline laser compatibility tests only; not evidence that plywood, emissions, or ventilation are safe.", "claims": ["The fixture links synthetic machine and process identities and supplies labeled environmental statuses for tests."]}
}
